{"$schema": "./schema.json", "instanceId": "glitch-rip.defaults", "theme": {}, "global": {"speed": 1, "delayOffset": 0, "easing": "ease-out-cubic"}, "elements": [], "extras": {"intervalSeconds": 3, "burstDurationSeconds": 0.9, "attackRatio": 0.18, "slices": 22, "shiftPx": 34, "rgbShiftPx": 8, "blocks": 0.55, "noise": 0.4, "rowBandMode": "slices", "blocksCellPx": 120, "scanlineEveryRows": 3, "scanlineOpacity": 0.18, "grainOpacity": 0.22, "quietFadeFrames": 4, "postBurstHoldFrames": 0, "deterministicSeed": 1}}